Command,Handle,Title,Body HTML,Vendor,Type,Tags,Published,Status,Published Scope,Variant SKU,Variant Barcode,Variant Position,Variant Price,Variant Compare At Price,Variant Cost,Variant Weight,Variant Weight Unit,Variant Inventory Tracker,Variant Inventory Policy,Variant Inventory Qty,Variant Fulfillment Service,Variant Requires Shipping,Variant Taxable,SEO Title,SEO Description,Google Shopping / MPN,Google Shopping / Condition,Variant Image,Image Src,Image Position,Image Alt Text,Option1 Name,Option1 Value,Option2 Name,Option2 Value,Option3 Name,Option3 Value,Variant Metafield: custom.produktinfo [multi_line_text_field],Variant Metafield: custom.variantbilleder [list.single_line_text_field]
MERGE,skuffeskab-moss-massivt-fyrretrae-gyldenbrun,,,,,,,,,42032405,8721364737563,1,749,999,438,12060,g,shopify,deny,179,manual,TRUE,TRUE,,,42032405,new,https://vdxl.im/8721364737563_mo-im_en_px16_1.jpg,,,,Farve,Brun,,,,,"<p>Dette moderne rulleskab med skrivebord kombinerer funktionalitet og stil og ser godt ud i dit hjem eller kontor. Med sine enkle, minimalistiske linjer giver det et stilfuldt og praktisk sted at arbejde og opbevare.</p> <ul> <li><b>Massivt fyrretræskonstruktion</b> Skabet er lavet af stærkt fyrretræ, der sikrer holdbarhed og lang levetid. Den naturlige træfinish tilføjer varme til rummet, og det er også bæredygtigt. Det tilbyder modstandskraft mod daglig brug, perfekt for dem, der ønsker en god investering.</li> <li><b>Indbygget foldbart skrivebord</b> Det foldbare skrivebord giver en praktisk arbejdsplads, der kan gemmes væk, når det ikke er i brug, og maksimerer pladsen. Det er især nyttigt for dem med lidt plads, da det giver et funktionelt skrivebord uden permanente møbler.</li> <li><b>Kantgreb</b> De subtile kantgreb holder skabets front ren og tilføjer et stilrent udtryk. De gør det nemt at få adgang til opbevaringsplads, samtidig med at de understøtter det minimalistiske design, hvilket gør det ideelt til moderne hjem.</li> <li><b>Holdbar konstruktion</b> Skabet er bygget til at holde, så det lover mange års brug. Dets strukturelle design opfylder mange opbevaringsbehov, hvilket gør det til en troværdig møbel i ethvert rum.</li> <li><b>Praktiske dimensioner</b> Med størrelsen 34 x 39 x 65,5 cm passer skabet perfekt ind i små rum og giver alsidighed. Det kan bruges i stuer, soveværelser eller kontorer.</li></ul> <ul><li>Farve: Klar lak</li><li>Materiale: Massivt fyrretræ</li><li>Samlede dimensioner: 34 x 39 x 65,5 cm (L x B x H)</li><li>Med 4 skuffer</li><li>Opbevaringsnummer: 4</li><li>Forsamling krævet: Ja</li><li>Leveringsindhold:</li><li>1 x Rulleskab med skrivebord</li></ul>","https://vdxl.im/8721364737563_mo-im_en_px16_1.jpg, https://vdxl.im/8721364737563_wbg-an-m_en_px16_1.jpg, https://vdxl.im/8721364737563_mo-im_en_px16_2.jpg, https://vdxl.im/8721364737563_wbg-an_en_px16_1.jpg, https://vdxl.im/8721364737563_wbg-fr_en_px16_1.jpg, https://vdxl.im/8721364737563_wbg-si_en_px16_1.jpg, https://vdxl.im/8721364737563_wbg-ba_en_px16_1.jpg, https://vdxl.im/8721364737563_detail_en_px16_1.jpg, https://vdxl.im/8721364737563_wbg-ma_en_px16_1.jpg, https://vdxl.im/8721364737563_wbg-siz_en_px16_1.jpg"
MERGE,skuffeskab-med-skrivebordsplade-moss-massivt-fyr-gyldenbrun,,,,,,,,,42032404,8721364737556,1,1409,1879,828,22390,g,shopify,deny,80,manual,TRUE,TRUE,,,42032404,new,https://vdxl.im/8721364737556_mo-im_en_px16_1.jpg,,,,Farve,Brun,,,,,"<p>Få et moderne touch med dette praktiske rulleskab med skrivebord, der er designet til at opfylde mange behov. Det enkle og funktionelle design gør det til den perfekte tilføjelse til ethvert hjem eller kontor. Dette stilfulde møbel bliver en uundgåelig hjælper for dem, der har brug for effektiv organisering og arbejdsplads. Den glatte rektangulære form sammen med den naturlige skønhed af massivt fyrretræ giver en moderne atmosfære, der løfter ethvert hjem eller arbejdsplads.</p> <ul><li><b>Moderne enkelhed:</b> Rulleskabet med skrivebord er designet med fokus på enkelhed og funktionalitet. De rene linjer og manglen på dekor gør det til en attraktiv samt praktisk tilføjelse til ethvert rum. Det moderne look passer perfekt ind i nutidig indretning.</li><li><b>Robust materiale:</b> Skabet er lavet af massivt fyrretræ, som sikrer lang levetid og stabilitet. Det robuste materiale holder længe, selv med daglig brug, og gør det til en troværdig løsning til hjemmekontorer eller soveværelser.</li><li><b>Integreret design:</b> Med et sammenfoldeligt skrivebord giver dette 2-i-1 design mulighed for pladsbesparelse, når det ikke er i brug. Uanset om det bruges som skrivebord eller opbevaringsskab, muliggør det funktionalitet og effektivitet for dem, der vil udnytte deres kvadratmeter bedst.</li><li><b>Praktiske funktioner:</b> Skabet er let at flytte takket være de monterede hjul. Det gør det nemt at ændre indretningen, hvilket forbedrer rummets fleksibilitet.</li><li><b>Unik opbevaringsløsning:</b> Med minimalistiske greb får du nem adgang til opbevaringen uden at gå på kompromis med det ryddelige udseende. Grebene er placeret strategisk for at gøre det nemt at bruge. <ul><li>Farve: Klar lak</li><li>Materiale: Massivt fyrretræ</li><li>Samlede dimensioner: 105,5 x 39 x 74,5 cm (L x B x H)</li><li>Med 7 skuffer</li><li>Opbevaringsnummer: 7</li><li>Forsamling krævet: Ja</li><li>Leveringsindhold:</li><li>1 x Rulleskab med skrivebord</li></ul>","https://vdxl.im/8721364737556_mo-im_en_px16_1.jpg, https://vdxl.im/8721364737556_wbg-an-m_en_px16_1.jpg, https://vdxl.im/8721364737556_mo-im_en_px16_2.jpg, https://vdxl.im/8721364737556_wbg-an_en_px16_1.jpg, https://vdxl.im/8721364737556_wbg-fr_en_px16_1.jpg, https://vdxl.im/8721364737556_wbg-si_en_px16_1.jpg, https://vdxl.im/8721364737556_wbg-ba_en_px16_1.jpg, https://vdxl.im/8721364737556_detail_en_px16_1.jpg, https://vdxl.im/8721364737556_wbg-fu_en_px16_1.jpg, https://vdxl.im/8721364737556_wbg-ma_en_px16_1.jpg, https://vdxl.im/8721364737556_wbg-siz_en_px16_1.jpg"
MERGE,skuffeskab-moss-massivt-fyrretrae,,,,,,,,,42032402,8721364737532,1,1169,1559,685,18040,g,shopify,deny,156,manual,TRUE,TRUE,,,42032402,new,https://vdxl.im/8721364737532_mo-im_en_px16_1.jpg,,,,Størrelse,34 x 39 x 103 cm,,,,,"<p>Dette moderne rulleskab med skuffer er en minimalistisk opbevaringsløsning, der let passer ind i enhver moderne bolig eller kontor. Det har et stilrent design med rene linjer og er let, hvilket gør det til et både fint og funktionelt møbel. Perfekt til at holde orden, giver dette skab en smart måde at opbevare personlige ting, papirer og meget mere, og balancerer form med funktion.</p> <ul><li><b>Kvalitetsmaterialer:</b> Dette skab er lavet af massivt fyrretræ, så det er ikke bare flot, men også robust, hvilket sikrer lang holdbarhed i dit hjem. Den naturlige åre i træet giver en unik stil og tilfører en naturlig charme til indretningen.</li> <li><b>Nem mobilitet:</b> Med fire hjul kan skabet flyttes rundt uden besvær, hvilket gør det let at tilpasse indretningen. Det er ideelt til rum, hvor der er brug for fleksibilitet.</li> <li><b>Funktionelle skuffer:</b> Skabet har flere skuffer med kantgreb, hvilket gør det nemt at få fat i tingene uden unødvendige fremspring, og giver et stilrent udseende. Det hjælper med at gemme rod væk og holder rummet pænt.</li> <li><b>Simpel samling:</b> Du skal bruge to personer og en skruetrækker for at samle det, hvilket gør det til en ligetil opgave. Det sikrer, at opsætningen er nem og passer til det moderne, brugervenlige design.</li> <li><b>Indendørs brug:</b> Passer perfekt til både hjemmet og kontoret, trives dette skab i stuer, soveværelser eller arbejdspladser, og giver en smart, effektiv opbevaringsløsning.</li> </ul> <ul><li>Farve: Klar lak</li><li>Materiale: Massivt fyrretræ</li><li>Samlede dimensioner: 34 x 39 x 103 cm (L x B x H)</li><li>Med 8 skuffer</li><li>Opbevaringsnummer: 8</li><li>Forsamling krævet: Ja</li><li>Leveringsindhold:</li><li>1 x Rulleskab med skuffer</li></ul>","https://vdxl.im/8721364737532_mo-im_en_px16_1.jpg, https://vdxl.im/8721364737532_wbg-an-m_en_px16_1.jpg, https://vdxl.im/8721364737532_mo-im_en_px16_2.jpg, https://vdxl.im/8721364737532_wbg-an_en_px16_1.jpg, https://vdxl.im/8721364737532_wbg-fr_en_px16_1.jpg, https://vdxl.im/8721364737532_wbg-si_en_px16_1.jpg, https://vdxl.im/8721364737532_wbg-ba_en_px16_1.jpg, https://vdxl.im/8721364737532_detail_en_px16_1.jpg, https://vdxl.im/8721364737532_wbg-ma_en_px16_1.jpg, https://vdxl.im/8721364737532_wbg-siz_en_px16_1.jpg"
MERGE,skuffeskab-moss-massivt-fyrretrae,,,,,,,,,42032403,8721364737549,2,1469,1959,864,23840,g,shopify,deny,100,manual,TRUE,TRUE,,,42032403,new,https://vdxl.im/8721364737549_mo-im_en_px16_1.jpg,,,,Størrelse,53 x 39 x 103 cm,,,,,"<p>Dette moderne rulleskab med skuffer er en minimalistisk opbevaringsløsning, der let passer ind i enhver moderne bolig eller kontor. Det har et stilrent design med rene linjer og er let, hvilket gør det til et både fint og funktionelt møbel. Perfekt til at holde orden, giver dette skab en smart måde at opbevare personlige ting, papirer og meget mere, og balancerer form med funktion.</p> <ul><li><b>Kvalitetsmaterialer:</b> Dette skab er lavet af massivt fyrretræ, så det er ikke bare flot, men også robust, hvilket sikrer lang holdbarhed i dit hjem. Den naturlige åre i træet giver en unik stil og tilfører en naturlig charme til indretningen.</li> <li><b>Nem mobilitet:</b> Med fire hjul kan skabet flyttes rundt uden besvær, hvilket gør det let at tilpasse indretningen. Det er ideelt til rum, hvor der er brug for fleksibilitet.</li> <li><b>Funktionelle skuffer:</b> Skabet har flere skuffer med kantgreb, hvilket gør det nemt at få fat i tingene uden unødvendige fremspring, og giver et stilrent udseende. Det hjælper med at gemme rod væk og holder rummet pænt.</li> <li><b>Simpel samling:</b> Du skal bruge to personer og en skruetrækker for at samle det, hvilket gør det til en ligetil opgave. Det sikrer, at opsætningen er nem og passer til det moderne, brugervenlige design.</li> <li><b>Indendørs brug:</b> Passer perfekt til både hjemmet og kontoret, trives dette skab i stuer, soveværelser eller arbejdspladser, og giver en smart, effektiv opbevaringsløsning.</li> </ul> <ul><li>Farve: Klar lak</li><li>Materiale: Massivt fyrretræ</li><li>Samlede dimensioner: 53 x 39 x 103 cm (L x B x H)</li><li>Med 8 skuffer</li><li>Opbevaringsnummer: 8</li><li>Forsamling krævet: Ja</li><li>Leveringsindhold:</li><li>1 x Rulleskab med skuffer</li></ul>","https://vdxl.im/8721364737549_mo-im_en_px16_1.jpg, https://vdxl.im/8721364737549_wbg-an-m_en_px16_1.jpg, https://vdxl.im/8721364737549_mo-im_en_px16_2.jpg, https://vdxl.im/8721364737549_wbg-an_en_px16_1.jpg, https://vdxl.im/8721364737549_wbg-fr_en_px16_1.jpg, https://vdxl.im/8721364737549_wbg-si_en_px16_1.jpg, https://vdxl.im/8721364737549_wbg-ba_en_px16_1.jpg, https://vdxl.im/8721364737549_detail_en_px16_1.jpg, https://vdxl.im/8721364737549_wbg-ma_en_px16_1.jpg, https://vdxl.im/8721364737549_wbg-siz_en_px16_1.jpg"
MERGE,skuffeskab-moss-massivt-fyrretrae-1,,,,,,,,,4015782,8721158359674,1,709,949,415,12000,g,shopify,deny,200,manual,TRUE,TRUE,,,4015782,new,https://vdxl.im/8721158359674_a_en_hd_1.jpg,,,,Farve,Sort,Størrelse,"34 x 39 x 65,5 cm",,,"<p>Dette skuffeskab hjælper dig med at holde dine ting og sager pænt organiseret og inden for nem rækkevidde.</p><p> </p><ul><li>Fleksible hjul: Hjulene gør det hurtigt og nemt at flytte rundt på skuffeskabet.</li><li>God opbevaringsplads: Arkivskabet giver rigelig med plads til at opbevare eller sortere dokumenter, bøger eller mapper. Det kan placeres under dit skrivebord for at få det meste ud af gulvpladsen. Håndtagene gør det nemt at trække hver skuffe ud, så du kan få fat i de ting, du skal bruge.</li><li>Massivt fyrretræ: Massivt fyrretræ er et smukt og naturligt materiale. Fyrretræ har lige åremønstre, og knuderne giver materialet sit karakteristiske, rustikke udseende.</li><li>Bred anvendelse: Skuffeskabet har et enkelt design, så det passer godt ind i ethvert rum. Det er et praktisk opbevaringsmøbel, der kan bruges i stuen, soveværelset, køkkenet, garagen, på kontoret, i hobbyværelset mv.</li><li>Nem rengøring: Kontorskabet har en glat overfalde, som er let at rengøre med en fugtig klud.</li></ul><p> </p><p>Advarsel:</p><ul><li>For at undgå, at produktet vælter, skal det anvendes med det medfølgende vægmonteringsudstyr.</li></ul> <ul><li>Farve: Sort</li><li>Materiale: Massivt fyrretræ, konstrueret træ, plastik</li><li>Mål: 34 x 39 x 65,5 cm (B x D x H)</li><li>Udvendige mål, skuffe: 27,5 x 34 x 9 cm (B x D x H)</li><li>Indvendige mål, skuffe: 26 x 33,5 x 7 cm (B x D x H)</li><li>Med 6 skuffer</li><li>Sortiment: MOSS</li><li>Montering påkrævet: Ja</li></ul>","https://vdxl.im/8721158359674_a_en_hd_1.jpg, https://vdxl.im/8721158359674_g_en_hd_1.jpg, https://vdxl.im/8721158359674_g_en_hd_2.jpg, https://vdxl.im/8721158359674_g_en_hd_3.jpg, https://vdxl.im/8721158359674_g_en_hd_4.jpg, https://vdxl.im/8721158359674_g_en_hd_5.jpg, https://vdxl.im/8721158359674_g_en_hd_6.jpg, https://vdxl.im/8721158359674_g_en_hd_7.jpg, https://vdxl.im/8721158359674_g_en_hd_8.jpg, https://vdxl.im/8721158359674_g_en_hd_9.jpg"
MERGE,skuffeskab-moss-massivt-fyrretrae-1,,,,,,,,,42032400,8721364737518,2,759,1019,447,12160,g,shopify,deny,195,manual,TRUE,TRUE,,,42032400,new,https://vdxl.im/8721364737518_mo-im_en_px16_1.jpg,,,,Farve,Brun,Størrelse,"34 x 39 x 65,5 cm",,,"<p>Dette moderne rulleskab med skuffer giver en stilren og praktisk løsning til opbevaring i dit hjem eller kontor. Med sit moderne design og rene linjer passer det perfekt ind i forskellige rum. Uanset om du har brug for at rydde op i stuen, soveværelset eller dit hjemmekontor, giver dette skab god plads, så du kan holde det pænt og organiseret.</p> <ul><li><b>Solidt fyrretræ:</b> Dette skab er lavet af kvalitetsfyrretræ, som sikrer, at det holder i lang tid. Den robuste konstruktion kan klare hverdagens slid uden at miste stil eller integritet.</li><li><b>Kantgreb:</b> Med smukke kantgreb har dette skab et minimalistisk look og praktisk funktionalitet. Grebene er designet til at give et godt tag og et strømlinet udseende, der passer perfekt til moderne indretning.</li><li><b>Fleksible hjul:</b> De låsbare hjul gør det nemt at flytte rundt uden problemer. Det gør det lettere at omplacere skabet i stuen, soveværelset, eller kontoret og øger dets funktionalitet.</li><li><b>Rummelige skuffer:</b> Med flere skuffer tilbyder dette rulleskab masser af opbevaringsplads til alt fra filer og kontorartikler til tøj og accessories. Det hjælper med at holde orden ved at give specifikke pladser til forskellige ting.</li><li><b>Nem samling:</b> Det kræver to personer og en skruetrækker, men samlingen er enkel. Dette gør det nemt for de fleste at samle det hurtigt, uden brug for professionel hjælp.</li></ul> <ul><li>Farve: Klar lak</li><li>Materiale: Massivt fyrretræ</li><li>Samlede dimensioner: 34 x 39 x 65,5 cm (L x B x H)</li><li>Med 6 skuffer</li><li>Opbevaringsnummer: 6</li><li>Forsamling krævet: Ja</li><li>Leveringsindhold:</li><li>1 x Rulleskab med skuffer</li></ul>","https://vdxl.im/8721364737518_mo-im_en_px16_1.jpg, https://vdxl.im/8721364737518_wbg-an-m_en_px16_1.jpg, https://vdxl.im/8721364737518_mo-im_en_px16_2.jpg, https://vdxl.im/8721364737518_wbg-an_en_px16_1.jpg, https://vdxl.im/8721364737518_wbg-fr_en_px16_1.jpg, https://vdxl.im/8721364737518_wbg-si_en_px16_1.jpg, https://vdxl.im/8721364737518_wbg-ba_en_px16_1.jpg, https://vdxl.im/8721364737518_detail_en_px16_1.jpg, https://vdxl.im/8721364737518_wbg-ma_en_px16_1.jpg, https://vdxl.im/8721364737518_wbg-siz_en_px16_1.jpg"
MERGE,skuffeskab-moss-massivt-fyrretrae-1,,,,,,,,,42032401,8721364737525,3,989,1319,582,11580,g,shopify,deny,92,manual,TRUE,TRUE,,,42032401,new,https://vdxl.im/8721364737525_mo-im_en_px16_1.jpg,,,,Farve,Brun,Størrelse,"53 x 39 x 65,5 cm",,,"<p>Dette moderne rulleskab med skuffer giver en stilren og praktisk løsning til opbevaring i dit hjem eller kontor. Med sit moderne design og rene linjer passer det perfekt ind i forskellige rum. Uanset om du har brug for at rydde op i stuen, soveværelset eller dit hjemmekontor, giver dette skab god plads, så du kan holde det pænt og organiseret.</p> <ul><li><b>Solidt fyrretræ:</b> Dette skab er lavet af kvalitetsfyrretræ, som sikrer, at det holder i lang tid. Den robuste konstruktion kan klare hverdagens slid uden at miste stil eller integritet.</li><li><b>Kantgreb:</b> Med smukke kantgreb har dette skab et minimalistisk look og praktisk funktionalitet. Grebene er designet til at give et godt tag og et strømlinet udseende, der passer perfekt til moderne indretning.</li><li><b>Fleksible hjul:</b> De låsbare hjul gør det nemt at flytte rundt uden problemer. Det gør det lettere at omplacere skabet i stuen, soveværelset, eller kontoret og øger dets funktionalitet.</li><li><b>Rummelige skuffer:</b> Med flere skuffer tilbyder dette rulleskab masser af opbevaringsplads til alt fra filer og kontorartikler til tøj og accessories. Det hjælper med at holde orden ved at give specifikke pladser til forskellige ting.</li><li><b>Nem samling:</b> Det kræver to personer og en skruetrækker, men samlingen er enkel. Dette gør det nemt for de fleste at samle det hurtigt, uden brug for professionel hjælp.</li></ul> <ul><li>Farve: Klar lak</li><li>Materiale: Massivt fyrretræ</li><li>Samlede dimensioner: 53 x 39 x 65,5 cm (L x B x H)</li><li>Med 6 skuffer</li><li>Opbevaringsnummer: 6</li><li>Forsamling krævet: Ja</li><li>Leveringsindhold:</li><li>1 x Rulleskab med skuffer</li></ul>","https://vdxl.im/8721364737525_mo-im_en_px16_1.jpg, https://vdxl.im/8721364737525_wbg-an-m_en_px16_1.jpg, https://vdxl.im/8721364737525_mo-im_en_px16_2.jpg, https://vdxl.im/8721364737525_wbg-an_en_px16_1.jpg, https://vdxl.im/8721364737525_wbg-fr_en_px16_1.jpg, https://vdxl.im/8721364737525_wbg-si_en_px16_1.jpg, https://vdxl.im/8721364737525_wbg-ba_en_px16_1.jpg, https://vdxl.im/8721364737525_detail_en_px16_1.jpg, https://vdxl.im/8721364737525_wbg-ma_en_px16_1.jpg, https://vdxl.im/8721364737525_wbg-siz_en_px16_1.jpg"
MERGE,haengende-hovedgavl-vaegmonteret-sort-100-55-5-cm-stof,Hængende Hovedgavl Vægmonteret Sort 100 55 5 Cm Stof,"<p>Dette moderne hængende hovedgærde er et eksempel på enkelhed og funktionalitet. Designet i en slank rektangulær form med elegante vertikale striber, tilføjer det et lækkert visuelt indtryk til ethvert soveværelse. Den bløde, polstrede overflade indbyder til afslapning, perfekt til at sidde eller læse. Det er ideelt for dem, der elsker raffineret stil uden besvær, da det glider hurtigt ind i forskellige indretningsstile og giver dit soveområde et stilrent look.</p> <ul><li><b>Elegant stoffinish</b> Lavet af 100% polyester, dette hovedgærde har et åndbart stof, der giver komfort og holdbarhed.</li><li><b>Integreret monteringssystem</b> Kommer med en pulverlakeret metalprofil og monteringstilbehør, som gør det nemt at montere på væggen. Det sikrer en stabil og sikker pasform og giver et rent, moderne look.</li><li><b>Aftagelige remme</b> Remmene giver dig mulighed for at flytte hovedgærdet rundt, så det passer til dit værelse og din stil. Perfekt til kreativ indretning.</li><li><b>Blødt polstring</b> Med en skumkerne gør dette hovedgærde det halvblødt og komfortabelt når du sidder op i sengen, perfekt til at slappe af.</li><li><b>Enkel vedligeholdelse</b> Bare tør hovedgærdet med en tør klud for at holde det friskt og flot. Det kræver ikke hårde rengøringsmidler eller meget arbejde.</li></ul> <p><strong>Godt at vide:</strong></p><ul><li>Alsidig i brug fungerer den problemfrit som sengegavl eller som en komfortabel ryglæn i spisestuer, entréer og andre opholdsrum.</li></ul>,<ul><li>Tjek venligst omhyggeligt dine sengens og gavlens mål, inden du køber.</li></ul> <ul><li>Farve: Sort</li><li>Materiale: Stof</li><li>Stoffets sammensætning: 100% polyester</li><li>Rammemateriale: Konstrueret træ</li><li>Fyldmateriale: Skum</li><li>Samlede dimensioner: 100 x 55 x 5 cm (B x D x H)</li><li>Størrelse af sengestelpanel: 90 x 40 x 5 cm (b x D x H)</li><li>Vægmontering</li><li>Hængende Design</li><li>Aftagelige hængende remme</li><li>Blød, polstret senggavl</li><li>Flere anvendelser</li><li>Forsamling krævet: Ja</li><li>Leveringsindhold:</li><li>1 x Hængende Hovedgærde</li><li>1 x Pulverlakeret Metalbane</li><li>2 x Runde Metalplader</li><li>2 x Korte Aftagelige Bælter</li><li>Delvise Montageredskaber</li></ul>",vidaXL,Hovedgærder og fodgærder,"Møbler,Senge & tilbehør,Hovedgærder og fodgærder,Møbler > Senge & tilbehør > Hovedgærder og fodgærder,vidaXL,Sort,Parcel,K6",TRUE,active,global,42032251,8721364705067,1,379,509,223,5035,g,shopify,deny,37,manual,TRUE,TRUE,Hængende Hovedgavl Vægmonteret Sort 100 55 5 Cm Stof,Dette moderne hængende hovedgærde er et eksempel på enkelhed og funktionalitet.,42032251,new,https://vdxl.im/8721364705067_mo-im_en_px16_1.jpg,https://vdxl.im/8721364705067_mo-im_en_px16_1.jpg,1,Hængende Hovedgavl Vægmonteret Sort 100 55 5 Cm Stof - Hovedbillede,,,,,,,,
MERGE,haengende-hovedgavl-vaegmonteret-sort-100-55-5-cm-stof,,,,,,,,,,,,,,,,,,,,,,,,,,,,https://vdxl.im/8721364705067_wbg-an-m_en_px16_1.jpg,2,Hængende Hovedgavl Vægmonteret Sort 100 55 5 Cm Stof - Billede 2,,,,,,,,
MERGE,haengende-hovedgavl-vaegmonteret-sort-100-55-5-cm-stof,,,,,,,,,,,,,,,,,,,,,,,,,,,,https://vdxl.im/8721364705067_mo-im_en_px16_2.jpg,3,Hængende Hovedgavl Vægmonteret Sort 100 55 5 Cm Stof - Billede 3,,,,,,,,
MERGE,haengende-hovedgavl-vaegmonteret-sort-100-55-5-cm-stof,,,,,,,,,,,,,,,,,,,,,,,,,,,,https://vdxl.im/8721364705067_mo-im_en_px16_3.jpg,4,Hængende Hovedgavl Vægmonteret Sort 100 55 5 Cm Stof - Billede 4,,,,,,,,
MERGE,haengende-hovedgavl-vaegmonteret-sort-100-55-5-cm-stof,,,,,,,,,,,,,,,,,,,,,,,,,,,,https://vdxl.im/8721364705067_wbg-fr_en_px16_1.jpg,5,Hængende Hovedgavl Vægmonteret Sort 100 55 5 Cm Stof - Billede 5,,,,,,,,
MERGE,haengende-hovedgavl-vaegmonteret-sort-100-55-5-cm-stof,,,,,,,,,,,,,,,,,,,,,,,,,,,,https://vdxl.im/8721364705067_wbg-si_en_px16_1.jpg,6,Hængende Hovedgavl Vægmonteret Sort 100 55 5 Cm Stof - Billede 6,,,,,,,,
MERGE,haengende-hovedgavl-vaegmonteret-sort-100-55-5-cm-stof,,,,,,,,,,,,,,,,,,,,,,,,,,,,https://vdxl.im/8721364705067_wbg-ba_en_px16_1.jpg,7,Hængende Hovedgavl Vægmonteret Sort 100 55 5 Cm Stof - Billede 7,,,,,,,,
MERGE,haengende-hovedgavl-vaegmonteret-sort-100-55-5-cm-stof,,,,,,,,,,,,,,,,,,,,,,,,,,,,https://vdxl.im/8721364705067_detail_en_px16_1.jpg,8,Hængende Hovedgavl Vægmonteret Sort 100 55 5 Cm Stof - Billede 8,,,,,,,,
MERGE,haengende-hovedgavl-vaegmonteret-sort-100-55-5-cm-stof,,,,,,,,,,,,,,,,,,,,,,,,,,,,https://vdxl.im/8721364705067_detail_en_px16_2.jpg,9,Hængende Hovedgavl Vægmonteret Sort 100 55 5 Cm Stof - Billede 9,,,,,,,,
MERGE,haengende-hovedgavl-vaegmonteret-sort-100-55-5-cm-stof,,,,,,,,,,,,,,,,,,,,,,,,,,,,https://vdxl.im/8721364705067_wbg-ma_en_px16_1.jpg,10,Hængende Hovedgavl Vægmonteret Sort 100 55 5 Cm Stof - Billede 10,,,,,,,,
MERGE,haengende-hovedgavl-vaegmonteret-sort-100-55-5-cm-stof,,,,,,,,,,,,,,,,,,,,,,,,,,,,https://vdxl.im/8721364705067_wbg-siz_en_px16_1.jpg,11,Hængende Hovedgavl Vægmonteret Sort 100 55 5 Cm Stof - Billede 11,,,,,,,,
